{
  "id": "2023-01-30-wisdom-keepers-conversation-with-duane-elgin",
  "files": [
    {
      "path": "downloads/audio/2023-01-30-wisdom-keepers-conversation-with-duane-elgin.mp3",
      "sha256": "642a8365c2fe4f06c64cb2d82fd6be6b9418f3ce50134e02fbcde519d54ab4e5"
    },
    {
      "path": "downloads/video/2023-01-30-wisdom-keepers-conversation-with-duane-elgin.mp4",
      "sha256": "75bf1952df13240de39d38ed0e9d34b841c1c4aefde6697562ed2967d69001f5"
    },
    {
      "path": "sources/captions/2023-01-30-wisdom-keepers-conversation-with-duane-elgin.html",
      "sha256": "330b4ffd7338fe6c28a95d080f6067aa261f2134f8be30e4c3e55e82f35bf5ce"
    },
    {
      "path": "sources/captions/2023-01-30-wisdom-keepers-conversation-with-duane-elgin.md",
      "sha256": "07a580727f3a23193024c825dce5d11caebd93e4895cf4168d11d6fb5a958397"
    },
    {
      "path": "sources/captions/2023-01-30-wisdom-keepers-conversation-with-duane-elgin.vtt",
      "sha256": "edefc2362ad8db84e54c6750f544f38829b05a782aed2d36b80fca2ed8586192"
    },
    {
      "path": "sources/diarist/2023-01-30-wisdom-keepers-conversation-with-duane-elgin.srt",
      "sha256": "a1ec73ec88d5ecfd7a412e8e70073861b0046d707f73b0b2d8b839cd1b6e5cfb"
    },
    {
      "path": "sources/diarist/2023-01-30-wisdom-keepers-conversation-with-duane-elgin.txt",
      "sha256": "ef9051dd2f6b2403ad93dcfcde40f464d179535d2df25ac59cd5526a69225cbb"
    },
    {
      "path": "sources/transcripts/2023-01-30-wisdom-keepers-conversation-with-duane-elgin.html",
      "sha256": "0b77158f8ba3f5e881a9d039077fdf82aa7caacdd7f72aacd4f0a72877e28b0e"
    },
    {
      "path": "sources/transcripts/2023-01-30-wisdom-keepers-conversation-with-duane-elgin.md",
      "sha256": "20e3d01788770caf5ea38e8dcb1b3e7846f627c7f872d5c6aa69d1dd231c683f"
    },
    {
      "path": "sources/transcripts/_archive/2023-01-30-wisdom-keepers-conversation-with-duane-elgin.html",
      "sha256": "bbf269c0a7e7ec2088d1715a6affb6de728c6381ce09659de709ed9c7084ee79"
    },
    {
      "path": "sources/transcripts/_archive/2023-01-30-wisdom-keepers-conversation-with-duane-elgin.md",
      "sha256": "df089faeb1e9cac078f0b10c762594e880fccf87461d3a9950daf3ce135af9b2"
    }
  ],
  "captured_at": "2025-10-27",
  "license": "CC0-1.0",
  "recorded_date": "2023-01-30",
  "tools": [
    "yt-dlp 2025.03.10",
    "ffmpeg 6.1",
    "otter_ai 2025-09 pipeline",
    "llm_cleanup GPT-5 (2025-09)"
  ]
}