{
  "id": "2021-07-08-mind-blowing-lsd-secrets-revealed-rebel-spirit-radio",
  "files": [
    {
      "path": "downloads/audio/2021-07-08-mind-blowing-lsd-secrets-revealed-rebel-spirit-radio.mp3",
      "sha256": "be5036662abcf133e9ab49639531e75d2a9727d2e7c474cbd4370b2bfba1d9cf"
    },
    {
      "path": "downloads/video/2021-07-08-mind-blowing-lsd-secrets-revealed-rebel-spirit-radio.mp4",
      "sha256": "646ef99545cdf844f9bc35f5c69d4311271a9f8aece965fdaf52803333fe0f2c"
    },
    {
      "path": "sources/captions/2021-07-08-mind-blowing-lsd-secrets-revealed-rebel-spirit-radio.html",
      "sha256": "dcaf04d79e3964c313fd1ca38eb644dfb35190a97e18e1ef0238f01fbdebb971"
    },
    {
      "path": "sources/captions/2021-07-08-mind-blowing-lsd-secrets-revealed-rebel-spirit-radio.md",
      "sha256": "ed9c4fc795688e18190034ff3d86fc96d4ab9dbacef60381120427019c18783f"
    },
    {
      "path": "sources/captions/2021-07-08-mind-blowing-lsd-secrets-revealed-rebel-spirit-radio.vtt",
      "sha256": "89ab9700547beba3638b7c2378beabcf3a9606d03c622b2f5a1809ab02734c44"
    },
    {
      "path": "sources/diarist/2021-07-08-mind-blowing-lsd-secrets-revealed-rebel-spirit-radio.srt",
      "sha256": "6bda776a67c1ae403a32c016cebb4ae15801b1975ae6a2abe4b718d874099aa5"
    },
    {
      "path": "sources/diarist/2021-07-08-mind-blowing-lsd-secrets-revealed-rebel-spirit-radio.txt",
      "sha256": "1aa98dc84cc571e21e43a4e10963561f0d69875b20d051a2e9714362ea3a4ff2"
    },
    {
      "path": "sources/transcripts/2021-07-08-mind-blowing-lsd-secrets-revealed-rebel-spirit-radio.html",
      "sha256": "55c8eeaefb181de30c76b1d29d794965926c544403448565211c79c220925ff0"
    },
    {
      "path": "sources/transcripts/2021-07-08-mind-blowing-lsd-secrets-revealed-rebel-spirit-radio.md",
      "sha256": "bc25aa7e6cc6dae4bf6a21aad3b8aca2cc2cb3e28fc6ef3cf18da40164126e77"
    },
    {
      "path": "sources/transcripts/_archive/2021-07-08-mind-blowing-lsd-secrets-revealed-rebel-spirit-radio.html",
      "sha256": "46a0e43a39b479ff4ecebc465fbe74766e6c7eae92bf881819c68307a719c82c"
    },
    {
      "path": "sources/transcripts/_archive/2021-07-08-mind-blowing-lsd-secrets-revealed-rebel-spirit-radio.md",
      "sha256": "9f3ca08570d61f0d8366c4fe357ee8b07cab2e43b0db5588b0a17474276bc26b"
    }
  ],
  "captured_at": "2025-10-27",
  "license": "CC0-1.0",
  "recorded_date": "2021-07-08",
  "tools": [
    "yt-dlp 2025.03.10",
    "ffmpeg 6.1",
    "otter_ai 2025-09 pipeline",
    "llm_cleanup GPT-5 (2025-09)"
  ]
}