{
  "id": "2021-06-03-lsd-and-the-mind-of-the-universe-christopher-bache-phd-short",
  "files": [
    {
      "path": "sources/transcripts/extras/2021-06-03-lsd-and-the-mind-of-the-universe-christopher-bache-phd-short.html",
      "sha256": "fa55bfa518bcdb47b07957864f454d7c4359f0c58affeceed8e4eef4eb2b38d6"
    },
    {
      "path": "sources/transcripts/extras/2021-06-03-lsd-and-the-mind-of-the-universe-christopher-bache-phd-short.md",
      "sha256": "337577b5be3ab819e17e618fd1ccfcb535ec4d49d6ac2bc1fe47131c81090b18"
    }
  ],
  "captured_at": "2025-10-27",
  "license": "CC0-1.0",
  "recorded_date": "2021-06-03",
  "tools": [
    "yt-dlp 2025.03.10",
    "ffmpeg 6.1",
    "otter_ai 2025-09 pipeline",
    "llm_cleanup GPT-5 (2025-09)"
  ]
}