{
  "id": "2023-10-10-experience-of-the-human-being-of-the-future-short",
  "files": [
    {
      "path": "downloads/audio/2023-10-10-experience-of-the-human-being-of-the-future-short.mp3",
      "sha256": "38f290ec24339010e1cef459aa268603aef5530c6052f3b447327bf8901c14c6"
    },
    {
      "path": "downloads/video/2023-10-10-experience-of-the-human-being-of-the-future-short.mp4",
      "sha256": "dc6f67707ae2eb54b5b9f316540b3bea00cc3ef44bf72aca9dd477d305ddc954"
    },
    {
      "path": "sources/captions/2023-10-10-experience-of-the-human-being-of-the-future-short.html",
      "sha256": "819436cce3e56e950a9f0db251088ae697cfdd67fe5d31b219a4081d63b1584f"
    },
    {
      "path": "sources/captions/2023-10-10-experience-of-the-human-being-of-the-future-short.md",
      "sha256": "8aa2a7deba0405ad1413321576858543752629b76ec47e97c46023edb855854e"
    },
    {
      "path": "sources/captions/2023-10-10-experience-of-the-human-being-of-the-future-short.vtt",
      "sha256": "ec22527fcef0dd40659756d9da2a7724bcb619ef984776ee3137083a6d44a365"
    },
    {
      "path": "sources/diarist/2023-10-10-experience-of-the-human-being-of-the-future-short.srt",
      "sha256": "8d3d0e01c93ef309b0abbed2dc3f789f1ded8113d7fa76ffe1aefc79ed99bbda"
    },
    {
      "path": "sources/diarist/2023-10-10-experience-of-the-human-being-of-the-future-short.txt",
      "sha256": "dbceb84ba790f2d85e5ee36503c35fb9b2135125bb9faeb019a6032b567e2071"
    },
    {
      "path": "sources/transcripts/2023-10-10-experience-of-the-human-being-of-the-future-short.html",
      "sha256": "39e371bcd90723dee315ebc50cdc4bececdd78d0221d51a66d5cab2d0fb3d4b5"
    },
    {
      "path": "sources/transcripts/2023-10-10-experience-of-the-human-being-of-the-future-short.md",
      "sha256": "132605cf1e869f4a7d3694d7a7f0d88112a6be8d71eff6be37aaf808fe185f4e"
    },
    {
      "path": "sources/transcripts/_archive/2023-10-10-experience-of-the-human-being-of-the-future-short.html",
      "sha256": "599dc1476edcfabf3af89f21a137db239d8ec37e269e8471f33d709bda52025e"
    },
    {
      "path": "sources/transcripts/_archive/2023-10-10-experience-of-the-human-being-of-the-future-short.md",
      "sha256": "5c4f7dac3b3a740d680e586f9bfe7f9a335cf4fff6bf65da2eac65162b6a9c9a"
    }
  ],
  "captured_at": "2025-10-27",
  "license": "CC0-1.0",
  "recorded_date": "2023-10-10",
  "tools": [
    "yt-dlp 2025.03.10",
    "ffmpeg 6.1",
    "otter_ai 2025-09 pipeline",
    "llm_cleanup GPT-5 (2025-09)"
  ]
}