{
  "id": "2025-07-16-consciousness-psychedelics-and-collective-evolution",
  "files": [
    {
      "path": "downloads/audio/2025-07-16-consciousness-psychedelics-and-collective-evolution.mp3",
      "sha256": "7e9d86952c34d0fe5b1227ce537cf2ae4670a714cc1bd3dc055392223c22dbba"
    },
    {
      "path": "downloads/video/2025-07-16-consciousness-psychedelics-and-collective-evolution.mp4",
      "sha256": "5b9d9a6d77f4baaa283d9310a784c65aa12b37669ca079c7ece6f63c15f96041"
    },
    {
      "path": "sources/captions/2025-07-16-consciousness-psychedelics-and-collective-evolution.html",
      "sha256": "f61fbf076d6b58201b8c1bdb1143097cc88e5ff7d0ed94833fbe235a8386c3f5"
    },
    {
      "path": "sources/captions/2025-07-16-consciousness-psychedelics-and-collective-evolution.md",
      "sha256": "7983653b3d02723162865b87223f0af88610d049680479ee7a0e9b990200426a"
    },
    {
      "path": "sources/captions/2025-07-16-consciousness-psychedelics-and-collective-evolution.vtt",
      "sha256": "e8ae899a3642c57c45b304fe049330e47ed6dce019a62c60de81c408668df625"
    },
    {
      "path": "sources/diarist/2025-07-16-consciousness-psychedelics-and-collective-evolution.srt",
      "sha256": "722a662488c9322fffa38e3b711f6e83c7a273ecee20a6b697d9653cb5c1d08f"
    },
    {
      "path": "sources/diarist/2025-07-16-consciousness-psychedelics-and-collective-evolution.txt",
      "sha256": "823b27c0c44d222e62b1bc859567cd38bf40b93c8701c6d4421e0bfbe6ddbe5b"
    },
    {
      "path": "sources/transcripts/2025-07-16-consciousness-psychedelics-and-collective-evolution.html",
      "sha256": "63f6faf8f2921e559ba2fca0b7a69b3125723e6d77a550d551db2e61343d195e"
    },
    {
      "path": "sources/transcripts/2025-07-16-consciousness-psychedelics-and-collective-evolution.md",
      "sha256": "6efcb15540b000b7b299ce94f776d7662f6c14f16e49af2e9f5ff7b09e457db9"
    },
    {
      "path": "sources/transcripts/_archive/2025-07-16-consciousness-psychedelics-and-collective-evolution.html",
      "sha256": "d8bc882b8eb173789df103868a2ab92dbe9350fee69a720a8ed5598d07968e32"
    },
    {
      "path": "sources/transcripts/_archive/2025-07-16-consciousness-psychedelics-and-collective-evolution.md",
      "sha256": "6c56d0aa4241a74f61a6bb68aff569a6f10329f3310007637f4b3e64985c8a99"
    }
  ],
  "captured_at": "2025-10-27",
  "license": "CC0-1.0",
  "recorded_date": "2025-07-16",
  "tools": [
    "yt-dlp 2025.03.10",
    "ffmpeg 6.1",
    "otter_ai 2025-09 pipeline",
    "llm_cleanup GPT-5 (2025-09)"
  ]
}