{
  "id": "2020-10-04-a-visionary-experience-of-the-birth-of-the-future-human",
  "files": [
    {
      "path": "downloads/audio/2020-10-04-a-visionary-experience-of-the-birth-of-the-future-human.mp3",
      "sha256": "a62c3742498a041493b92d4390e99d24fc8646482ae9408fe2dca8d5aceae7d8"
    },
    {
      "path": "downloads/video/2020-10-04-a-visionary-experience-of-the-birth-of-the-future-human.mp4",
      "sha256": "f5b724840046ba96c748d8f1dba15bdac2e2a85a781b9e3af998928ecb51cada"
    },
    {
      "path": "sources/captions/2020-10-04-a-visionary-experience-of-the-birth-of-the-future-human.html",
      "sha256": "12c719f652548e6ff13141e22e4d64804ff00eb1b59557bdb0af645f063bdefa"
    },
    {
      "path": "sources/captions/2020-10-04-a-visionary-experience-of-the-birth-of-the-future-human.md",
      "sha256": "b7215cfcbc10b5a3c9f821d27208972739be88e508d3df56ee1b50faed125736"
    },
    {
      "path": "sources/captions/2020-10-04-a-visionary-experience-of-the-birth-of-the-future-human.vtt",
      "sha256": "3780c58b5aeb140b8002946b987cd602b3828fd403e33cbfdb5b57b2c15f3faa"
    },
    {
      "path": "sources/diarist/2020-10-04-a-visionary-experience-of-the-birth-of-the-future-human.srt",
      "sha256": "6b691242852a2ba684770345f34dd10bbb5c06f2e9ee5111efab6a89c0b2fad9"
    },
    {
      "path": "sources/diarist/2020-10-04-a-visionary-experience-of-the-birth-of-the-future-human.txt",
      "sha256": "9fc7eeb303fb781e727ab153a7d7a6f2f4a967ae3cdaad4ef5eef9b2272a8df6"
    },
    {
      "path": "sources/transcripts/2020-10-04-a-visionary-experience-of-the-birth-of-the-future-human.html",
      "sha256": "1e285b1675fd39c619e40fbedcd380af462d3c4f05e98c39c17112faf8a5e4ab"
    },
    {
      "path": "sources/transcripts/2020-10-04-a-visionary-experience-of-the-birth-of-the-future-human.md",
      "sha256": "9cd31270255ecaf06aff96e977588ce958bf6f08ca571debbb612a4234f7ea73"
    },
    {
      "path": "sources/transcripts/_archive/2020-10-04-a-visionary-experience-of-the-birth-of-the-future-human.html",
      "sha256": "4e4d20e381d2033eda8b47af90975c6e918a8f9bf6791811b5d823c9d3a565a6"
    },
    {
      "path": "sources/transcripts/_archive/2020-10-04-a-visionary-experience-of-the-birth-of-the-future-human.md",
      "sha256": "a28da1e19fa7bb32c9f6e8add894a9e70c495bce8ff598f457224059b12a577a"
    }
  ],
  "captured_at": "2025-10-27",
  "license": "CC0-1.0",
  "recorded_date": "2020-10-04",
  "tools": [
    "yt-dlp 2025.03.10",
    "ffmpeg 6.1",
    "otter_ai 2025-09 pipeline",
    "llm_cleanup GPT-5 (2025-09)"
  ]
}