{
  "id": "2022-02-19-the-mind-of-the-universe-conversation-with-prof-short",
  "files": [
    {
      "path": "sources/transcripts/extras/2022-02-19-the-mind-of-the-universe-conversation-with-prof-short.html",
      "sha256": "3708898b8a388a5e7ea1fd060545a7052b93ce6dd36ad06fffb23bf65294c4c1"
    },
    {
      "path": "sources/transcripts/extras/2022-02-19-the-mind-of-the-universe-conversation-with-prof-short.md",
      "sha256": "7885cf8aeb24d817f9b6c079101103d894f990350c1f3aea7774192fe792bb37"
    }
  ],
  "captured_at": "2025-10-13",
  "license": "CC0-1.0",
  "recorded_date": "2022-02-19",
  "tools": [
    "yt-dlp 2025.03.10",
    "ffmpeg 6.1",
    "otter_ai 2025-09 pipeline",
    "llm_cleanup GPT-5 (2025-09)"
  ]
}