{
  "id": "lsdmu-lsdmu.section-registry",
  "files": [
    {
      "path": "sources/transcripts/lsdmu/lsdmu.section-registry.json",
      "sha256": "c8ba7d799491f9a7a17d99aed6a196f4ce4b7f2601fa0d47167096f62eec0d93"
    }
  ],
  "captured_at": "2025-10-27",
  "license": "CC0-1.0",
  "recorded_date": "",
  "tools": [
    "yt-dlp 2025.03.10",
    "ffmpeg 6.1",
    "otter_ai 2025-09 pipeline",
    "llm_cleanup GPT-5 (2025-09)"
  ]
}