{
  "id": "2021-04-02-reincarnation-qanda-live-with-richard-rudd",
  "files": [
    {
      "path": "downloads/audio/2021-04-02-reincarnation-qanda-live-with-richard-rudd.mp3",
      "sha256": "79b7027317bc389c410da8804df736add219222e37b35c1fb96047526deb6eac"
    },
    {
      "path": "downloads/video/2021-04-02-reincarnation-qanda-live-with-richard-rudd.mp4",
      "sha256": "d654aa6f1099d03c6a205a15f8da4d6da07d055b26535be0098a62114a0be1b1"
    },
    {
      "path": "sources/captions/2021-04-02-reincarnation-qanda-live-with-richard-rudd.html",
      "sha256": "e841945905ac70f93d7f8f1afc0b0aba79593fee6ee0e36c0aa1f2f7f3afa80f"
    },
    {
      "path": "sources/captions/2021-04-02-reincarnation-qanda-live-with-richard-rudd.md",
      "sha256": "0f42a6a3e8713e93e9890f2e206a9d9ce7005efba58d1e1574c2ce04314c28dd"
    },
    {
      "path": "sources/captions/2021-04-02-reincarnation-qanda-live-with-richard-rudd.vtt",
      "sha256": "6cb04cd7ecd2e33027c75a36b271770ad1e49fb53e3b5ee1772d3429ddc7bb89"
    },
    {
      "path": "sources/diarist/2021-04-02-reincarnation-qanda-live-with-richard-rudd.srt",
      "sha256": "beeb239479fed389d09b7230d4bce8eadbe9128f9f1d776e5ea5b8ceeb0857c1"
    },
    {
      "path": "sources/diarist/2021-04-02-reincarnation-qanda-live-with-richard-rudd.txt",
      "sha256": "1bb21c7d90eafaadd1b554ddb040b6060d12692d3592764270817df654f974b6"
    },
    {
      "path": "sources/transcripts/2021-04-02-reincarnation-qanda-live-with-richard-rudd.html",
      "sha256": "4b10c958208fe7b09df336e82c9658b9afde8336dc6bcdf24dd35bbf8dc18194"
    },
    {
      "path": "sources/transcripts/2021-04-02-reincarnation-qanda-live-with-richard-rudd.md",
      "sha256": "dd437f0fa1d54cb2fa4e662dfcecc362abb4a72a2e4ef40275ebe5b07d1ce668"
    },
    {
      "path": "sources/transcripts/_archive/2021-04-02-reincarnation-qanda-live-with-richard-rudd.html",
      "sha256": "e2ee3c28955c07f15eddc9ce4d5bf16a91c25ff8e60e5489fdce4db280f79826"
    },
    {
      "path": "sources/transcripts/_archive/2021-04-02-reincarnation-qanda-live-with-richard-rudd.md",
      "sha256": "343fc057bbf8dae6f7830688636d19f3247f055076329a27932839fdf8ac3b06"
    }
  ],
  "captured_at": "2025-10-27",
  "license": "CC0-1.0",
  "recorded_date": "2021-04-02",
  "tools": [
    "yt-dlp 2025.03.10",
    "ffmpeg 6.1",
    "otter_ai 2025-09 pipeline",
    "llm_cleanup GPT-5 (2025-09)"
  ]
}