{
  "id": "2020-04-19-bicycle-day-conversation-with-jef-baker",
  "files": [
    {
      "path": "downloads/audio/2020-04-19-bicycle-day-conversation-with-jef-baker.mp3",
      "sha256": "b226d1e17cb17e498cd671ff5c6773afbdb2da0e04a4d3dcb30c7594889866f5"
    },
    {
      "path": "downloads/video/2020-04-19-bicycle-day-conversation-with-jef-baker.mp4",
      "sha256": "5da6f1508586434b8193279bb564278571c52ee1dcb420e9689edb282d055e78"
    },
    {
      "path": "sources/captions/2020-04-19-bicycle-day-conversation-with-jef-baker.html",
      "sha256": "88dcbe29580beda8a1997667648c64b02c79704da9cd6aadf355f235c41abb4b"
    },
    {
      "path": "sources/captions/2020-04-19-bicycle-day-conversation-with-jef-baker.md",
      "sha256": "55cd1f88ea77f3f7c4904daded49c14b3a53f18bcd6dabc34123635dc5dc13a3"
    },
    {
      "path": "sources/captions/2020-04-19-bicycle-day-conversation-with-jef-baker.vtt",
      "sha256": "0f9bce60fd746cb5a80babd15d3f56dbd5e0e4422f88e19e54e82d1770d69970"
    },
    {
      "path": "sources/diarist/2020-04-19-bicycle-day-conversation-with-jef-baker.srt",
      "sha256": "5ebdae2da9e13336391d453e6e20f9dce5f5565d25433c147528007494897d23"
    },
    {
      "path": "sources/diarist/2020-04-19-bicycle-day-conversation-with-jef-baker.txt",
      "sha256": "ad925c1847db1d727f989310d25b52b0fe013044c6efb47d05a940ae209f19d3"
    },
    {
      "path": "sources/transcripts/2020-04-19-bicycle-day-conversation-with-jef-baker.html",
      "sha256": "bbb8c6208faf12d615304d740a5734e015aabc1af27ffbfe936fc5cb810493c0"
    },
    {
      "path": "sources/transcripts/2020-04-19-bicycle-day-conversation-with-jef-baker.md",
      "sha256": "6f20aa0851907446d1e152eccf05b866c92b4bc30009e4641fb3a33c6a316095"
    },
    {
      "path": "sources/transcripts/_archive/2020-04-19-bicycle-day-conversation-with-jef-baker.html",
      "sha256": "1537712cbedbb05c685e0049d1e6e8e0d6d9a144d7fabeca054cb2c5733854fa"
    },
    {
      "path": "sources/transcripts/_archive/2020-04-19-bicycle-day-conversation-with-jef-baker.md",
      "sha256": "fa5bb28b51eb36d7fa103363b35cf7a970cd6d84fa4d08071a63e18c6fd27312"
    }
  ],
  "captured_at": "2025-10-27",
  "license": "CC0-1.0",
  "recorded_date": "2020-04-19",
  "tools": [
    "yt-dlp 2025.03.10",
    "ffmpeg 6.1",
    "otter_ai 2025-09 pipeline",
    "llm_cleanup GPT-5 (2025-09)"
  ]
}